<?xml version="1.0" encoding="utf-8" ?>
<!--/*
This file is part of OSAMES Micro ORM.
Copyright 2014 OSAMES

OSAMES Micro ORM is free software: you can redistribute it and/or modify
it under the terms of the GNU Affero General Public License as published by
the Free Software Foundation, either version 3 of the License, or
(at your option) any later version.

OSAMES Micro ORM is distributed in the hope that it will be useful,
but WITHOUT ANY WARRANTY; without even the implied warranty of
MERCHANTABILITY or FITNESS FOR A PARTICULAR PURPOSE.  See the
GNU Affero General Public License for more details.

You should have received a copy of the GNU Affero General Public License
along with OSAMES Micro ORM.  If not, see <http://www.gnu.org/licenses/>.
*/-->
<xs:schema xmlns:xs="http://www.w3.org/2001/XMLSchema" xmlns="http://www.osames.org/osamesorm"
  xmlns:orm="http://www.osames.org/osamesorm" targetNamespace="http://www.osames.org/osamesorm"
  elementFormDefault="qualified">
  <xs:element name="Tables" type="typeTable" />
  <xs:complexType name="typeTable">
    <xs:sequence>
      <xs:element name="Table" minOccurs="1" maxOccurs="unbounded">
        <xs:complexType>
          <xs:sequence>
            <xs:element name="MappingObject" minOccurs="1" maxOccurs="unbounded">
              <xs:complexType>
                <xs:attribute name="column" type="xs:string" use="required" />
                <xs:attribute name="property" type="xs:string" use="required" />
              </xs:complexType>
            </xs:element>
          </xs:sequence>
          <xs:attribute name="name" type="xs:string" />
        </xs:complexType>
      </xs:element>
    </xs:sequence>
  </xs:complexType>
</xs:schema>
